{"acceptance":{"all_42_once":false,"all_climates":true,"all_map_sizes":true,"all_programs":true,"broad_retained":false,"learned_lower_ci_above_random":true,"learned_lower_ci_above_wait":true,"native_g15_g21_retained":false,"no_failures":false,"opponents_retained":false,"overall":false,"service_every_mode":false},"artifact_root":"/home/thecl/.codex/artifacts/openttd-rl/v2-m22-final-evaluation-b","failure_counts":{"broad-retention":2,"evaluator-identity":0,"evaluator-process":0,"evaluator-public-boundary":0,"evaluator-report":0,"learned-program-mismatch":0,"native-execution":8,"native-service":0,"opponent-retention":0},"history":{"cases_attempted":0,"failure_category":"final-manifest-adapter","manifest_reads":1,"prior_attempt":"config/v2/m22-final-attempt-a.json","status":"REJECTED_BEFORE_CASE_EXECUTION"},"identity":{"aggregate_schema_sha256":"a6bf709cdaae45eab7e8c5bd7178f48ad49fe8126af84d4f6cf92672631f3181","bubblewrap_sha256":"52231e1caf55bcbc667b269f49c63599a6f7db4767ae6a039580d0ff853db712","checkpoint_id":"03894fd1238b69b6724d82eb441380312be4e8226efa602fa5e43972f7fa9f5f","evaluation_manifest_schema_sha256":"79c97aeca1332b54f65b2fb816a30b0cb303d45553b497fc3e66d6fae005cb22","evaluator_executable_sha256":"bc87f4608643b4664068381fa5136d464c44bd05dad09a66fa088bfa995b92e6","evaluator_report_schema_sha256":"fb77ef713c7a749cef9b22d3d5ef5b97ad97389ca119ad309d25419ee0766b45","learning_contract_sha256":"f3ae8f89dfb6edf19b910c55f55845279b77ddd7be5adbd1db244984f968b07b","native_executable_sha256":"f38b63a2d431411d30e44e7d3c43e46268cf2556c3bde1b74bc3291af52b0577","native_source_tree":"0a5e2aca102b6713c74fceff3aa7b512fb06a13c","prior_attempt_sha256":"982327be57833e91482ae10ef98d0b2a17d56da6ccf914748707fae3991ba682","qualification_evidence_sha256":"192f784c54420f99e01384c4c453e2df651c2d87b479c0bee3dc46bf3b5a3798","runtime_source_sha256":"c0412f09f2887682f7fdc19179e626a36e1129d80e37623541eb955c7a61e2a9"},"manifest":{"case_count":42,"id":"m22-independent-final-v1","path":"config/v2/m22-evaluation-manifest.json","sha256":"e35383d49ff72e36249a1cce4750153c41a39526b2f769f029a8f4619a203697"},"preflight":{"evaluator":{"action":"road-passenger","action_index":1,"failure_category":null,"failure_detail":null,"legal_active_program":"road-passenger","process":{"attempt":1,"exit_code":0,"fresh_process":true,"launched":true,"network_unshared":true,"stderr_path":"evaluator.stderr","stderr_sha256":"e3b0c44298fc1c149afbf4c8996fb92427ae41e4649b934ca495991b7852b855","stdout_path":"evaluator.stdout","stdout_sha256":"580ef376df61311b2d4a2fbcf31788473d9896229751ad036e754f7a9342b12c","timed_out":false,"wall_seconds":1.83388050299},"report_path":"evaluator-report.json","report_sha256":"494ea14594dfee8a53c462a613623f6b13d2a36c02ae0568f62dbebba94d85c7","status":"PASS"},"public_case":{"cargo":"PASS","case_id":"source-preflight-g15-road","climate":"temperate","map_height":64,"map_width":64,"native_probe":"passenger-service","opponent":"not-applicable","source_gate":"G15","task":"service","transport_mode":"road"}},"protocol":{"case_order":["road-passenger-64","road-passenger-128","road-passenger-512x128","road-passenger-1024","road-cargo-temperate-mail","road-cargo-temperate-coal","road-cargo-arctic-mail","road-cargo-arctic-food","road-cargo-tropic-mail","road-cargo-tropic-maize","road-cargo-toyland-mail","road-cargo-toyland-sugar","rail-passenger-a","rail-passenger-b","rail-freight-a","rail-freight-b","ship-natural-passenger","ship-natural-freight","ship-constructed-passenger","ship-constructed-freight","air-airplane-passenger","air-airplane-goods","air-helicopter-passenger","air-helicopter-mail","multimodal-passenger-a","multimodal-passenger-b","multimodal-router-a","multimodal-router-b","competition-aaahogex-a","competition-aaahogex-b","competition-krakenai2-a","competition-krakenai2-b","competition-noopai-a","competition-noopai-b","broad-calendar-temperate","broad-calendar-arctic","broad-calendar-tropic","broad-calendar-toyland","broad-authority-economy","broad-events","broad-gamescript","broad-content"],"cases_attempted":42,"cases_declared":42,"evaluator_attempts":42,"evaluator_processes":42,"manifest_reads":1,"native_dispatches":42,"native_processes":34,"post_result_selection":false,"prior_nonexecuting_attempts":1,"replacements":0,"retries":0,"total_manifest_reads":2},"report_sha256":"b8146af28d5bb14ba9f97ae4e55cb7f8476355d00319636138a7dc24a99a5a4b","runs":[{"artifact_path":"cases/00-road-passenger-64","evaluator":{"action":"road-passenger","action_index":1,"failure_category":null,"failure_detail":null,"legal_active_program":"road-passenger","process":{"attempt":1,"exit_code":0,"fresh_process":true,"launched":true,"network_unshared":true,"stderr_path":"evaluator.stderr","stderr_sha256":"e3b0c44298fc1c149afbf4c8996fb92427ae41e4649b934ca495991b7852b855","stdout_path":"evaluator.stdout","stdout_sha256":"580ef376df61311b2d4a2fbcf31788473d9896229751ad036e754f7a9342b12c","timed_out":false,"wall_seconds":1.44702836798},"report_path":"evaluator-report.json","report_sha256":"19456308dda75a65d154e1b196bb6f97f52124b788e98cdeac93e65af17abdd0","status":"PASS"},"failures":[],"native":{"artifact_inventory":[{"bytes":790528,"path":"artifacts/capture-service-branch-a-candidates.bin","sha256":"cb3459e91960368999310057399856805f362d4c88a34852a705e3035d0b436a"},{"bytes":449247,"path":"artifacts/capture-service-branch-a-candidates.json","sha256":"896deb599f5a0dfa032a4913148b5f088787ae0fa65f59db9a25dc4b41c81230"},{"bytes":2182927,"path":"artifacts/capture-service-branch-a-observation.bin","sha256":"af05bee74ce3cd8c9467835c85072891d51d20c7f08e21b9db5c92900dfb3fb1"},{"bytes":3411,"path":"artifacts/capture-service-branch-a-observation.json","sha256":"5ff0dcbf5900b1788fb888bfa7e7acd30fb08c51b212ed8d2b94eceee6de9f12"},{"bytes":15056,"path":"artifacts/capture-service-branch-a.sav","sha256":"b724249df6b8d975b4e54fe1fa57d6b58edd6678fb889ec53b3eb78b6bf56ab6"},{"bytes":790528,"path":"artifacts/capture-service-branch-b-candidates.bin","sha256":"cb3459e91960368999310057399856805f362d4c88a34852a705e3035d0b436a"},{"bytes":449247,"path":"artifacts/capture-service-branch-b-candidates.json","sha256":"bef6ff0118c698c8fe1391589be20af01699db85f75ed50d990db5e0607aff37"},{"bytes":2182927,"path":"artifacts/capture-service-branch-b-observation.bin","sha256":"af05bee74ce3cd8c9467835c85072891d51d20c7f08e21b9db5c92900dfb3fb1"},{"bytes":3411,"path":"artifacts/capture-service-branch-b-observation.json","sha256":"946f9cf0ec727e730f791a16a1cf03d8f43f04dcc0ee4e1706efe0c97afd1758"},{"bytes":15056,"path":"artifacts/capture-service-branch-b.sav","sha256":"b724249df6b8d975b4e54fe1fa57d6b58edd6678fb889ec53b3eb78b6bf56ab6"},{"bytes":15056,"path":"artifacts/service-ready.sav","sha256":"b724249df6b8d975b4e54fe1fa57d6b58edd6678fb889ec53b3eb78b6bf56ab6"},{"bytes":816,"path":"manifest.json","sha256":"acd2169bc592875c9303113cff9e11d0f1a652da2f335a5c03f5bfa69f6eb576"},{"bytes":0,"path":"openttd.log","sha256":"e3b0c44298fc1c149afbf4c8996fb92427ae41e4649b934ca495991b7852b855"},{"bytes":8296,"path":"report.json","sha256":"4705c2447d54420fc55627bb24806ce70548f835287007e316a8d8e03f3b9686"},{"bytes":942,"path":"reset.json","sha256":"a3671164774c3de3a9432cac5d420f7320d72138c048a447944146b0189ee3f7"}],"attempt":1,"failure_category":null,"failure_detail":null,"record":{"case":{"cargo":"PASS","case_id":"road-passenger-64","climate":"temperate","map_height":64,"map_width":64,"native_probe":"m15-competence","opponent":"not-applicable","source_gate":"G15","task":"service","transport_mode":"road"},"executable_sha256":"f38b63a2d431411d30e44e7d3c43e46268cf2556c3bde1b74bc3291af52b0577","fresh_processes":1,"manifest_path":"manifest.json","manifest_sha256":"acd2169bc592875c9303113cff9e11d0f1a652da2f335a5c03f5bfa69f6eb576","metrics":{"delivered":2,"income":3,"ticks":1376,"vehicle_capacity":31},"native_probe":"passenger-service","network_unshared":true,"openttd_log_path":"openttd.log","openttd_log_sha256":"e3b0c44298fc1c149afbf4c8996fb92427ae41e4649b934ca495991b7852b855","report_path":"report.json","report_sha256":"4705c2447d54420fc55627bb24806ce70548f835287007e316a8d8e03f3b9686","source_tree":"0a5e2aca102b6713c74fceff3aa7b512fb06a13c","status":"PASS","wall_seconds":0.341497},"status":"PASS"},"ordinal":0,"private_seed":2085900215,"public_case":{"cargo":"PASS","case_id":"road-passenger-64","climate":"temperate","map_height":64,"map_width":64,"native_probe":"m15-competence","opponent":"not-applicable","source_gate":"G15","task":"service","transport_mode":"road"},"required_program":"road-passenger","scores":{"baselines":[{"action":"road-passenger","correct":true,"decision_seed":817489831,"policy":"seeded-random-legal","return":1.17917594692},{"action":"wait","correct":false,"decision_seed":null,"policy":"wait-only","return":0.0},{"action":"road-passenger","correct":true,"decision_seed":null,"policy":"public-heuristic-v1","return":1.17917594692}],"learned_correct":true,"learned_return":1.17917594692,"native_reward":1.17917594692}},{"artifact_path":"cases/01-road-passenger-128","evaluator":{"action":"road-passenger","action_index":1,"failure_category":null,"failure_detail":null,"legal_active_program":"road-passenger","process":{"attempt":1,"exit_code":0,"fresh_process":true,"launched":true,"network_unshared":true,"stderr_path":"evaluator.stderr","stderr_sha256":"e3b0c44298fc1c149afbf4c8996fb92427ae41e4649b934ca495991b7852b855","stdout_path":"evaluator.stdout","stdout_sha256":"580ef376df61311b2d4a2fbcf31788473d9896229751ad036e754f7a9342b12c","timed_out":false,"wall_seconds":1.27392964499},"report_path":"evaluator-report.json","report_sha256":"8d1529f6fe26de38968e231c764b70e63bc3536f769e05f1fe10daae3df0dbed","status":"PASS"},"failures":[],"native":{"artifact_inventory":[{"bytes":790528,"path":"artifacts/capture-service-branch-a-candidates.bin","sha256":"39385b11a0017e77c8f787fcade1d4711cbba41d903c1b10e0f347de52e08640"},{"bytes":452857,"path":"artifacts/capture-service-branch-a-candidates.json","sha256":"3298c9a3aa4a84dec5425dbfa30d1e0fdc57